HSCode,Commodity,HS2,Product_ID,Industry_Category,Product_Type,Created_At
382561,OTHR WASTE MAINLY CONTN. ORGNIC CONSTIUENT,38,1776,Chemicals & Allied Industries,Industrial Goods,2023-01-01 11:27:55
382569,OTHR WASTE OF ORGANIC AND ALIED INDUSTRIES,38,1777,Chemicals & Allied Industries,Industrial Goods,2023-01-01 11:28:00
382590,OTHER RESUDUAL PRODUCTS NES,38,1778,Chemicals & Allied Industries,Industrial Goods,2023-01-01 11:28:05
382600,"BIODIESEL AND MIXTURES, NT CONTAINING OR CONTAINING L< 70 % BY WEIGHT OF PETROLEUM OILS / OILS  FROM BITUMINOUS MINERALS",38,1779,Chemicals & Allied Industries,Industrial Goods,2023-01-01 11:28:10
382711,"CONTAINING CFCs,WHETHER OR NOT CONTAINING HYDROCHLOROFLUOROCARBONS,PERFLUOROCARBONS(PFCs)OR HYDROFLUROCARBONS(HFCs)",38,1780,Chemicals & Allied Industries,Industrial Goods,2023-01-01 11:28:15
382720,"CONTAINING BROMOCHLORODIFLUOROMETHANE(HALON-1211),BROMOTRIFLUOROMETHANE(HALON-1301)/DIBROMOTETRAFLUOROMETHANE(HALON2402)",38,1781,Chemicals & Allied Industries,Industrial Goods,2023-01-01 11:28:20
382739,OTHER,38,1782,Chemicals & Allied Industries,Industrial Goods,2023-01-01 11:28:25
382740,CONTAINING METHYL BROMIDE (BROMOMETHANE) OR BROMOCHLOROMETHANE,38,1783,Chemicals & Allied Industries,Industrial Goods,2023-01-01 11:28:30
382761,"CONTAINING 15% OR MORE BY MASS OF 1,1,1-TRIFLUROETHANE (HFC-143a)",38,1784,Chemicals & Allied Industries,Industrial Goods,2023-01-01 11:28:35
382763,"OTHER,NOT INCLUDED IN THE SUB-HEADINGS ABOVE, CONTAINING 40% OR MORE BY MASS OF PENTAFLUROETHANE (HFC-125)",38,1785,Chemicals & Allied Industries,Industrial Goods,2023-01-01 11:28:40
382764,"OTHR,NT INCL. IN THE SUB-HDNG ABVE,CONTNG 30% OR MORE BY MAS OF 1,1,1,2-HFC-134a BT NT CONT UNSAT FLUORINATE DRVT OF HFO",38,1786,Chemicals & Allied Industries,Industrial Goods,2023-01-01 11:28:45
382765,"OTHR,NT INCL. IN THE SUB-HDNG ABOVE, CONTNG 20% OR MORE BY MASS OF HFC 32  AND 20% OR MORE BY MASS OF  HFC-125",38,1787,Chemicals & Allied Industries,Industrial Goods,2023-01-01 11:28:50
382768,"OTHER,NOT INCLUDED IN THE SUB-HEADINGS ABOVE,CONTAINING SUBSTANCES OF SUB HEADINGS 290341 TO 29348",38,1788,Chemicals & Allied Industries,Industrial Goods,2023-01-01 11:28:55
382790,OTHER,38,1789,Chemicals & Allied Industries,Industrial Goods,2023-01-01 11:29:00
390110,POLYETHYLENE HVNG A SPFC GRVTY BELOW 0.94,39,1790,Plastics & Rubber,Manufactured Goods,2023-01-01 11:29:05
390120,POLYETHYLENE HVNG A SPCFC GRVTY 0.94 /MORE,39,1791,Plastics & Rubber,Manufactured Goods,2023-01-01 11:29:10
390130,ETHYLENE-VINYL ACETATE COPOLYMERS,39,1792,Plastics & Rubber,Manufactured Goods,2023-01-01 11:29:15
390140,"ETHYLENE-ALPHA-OLEFIN COPOLYMERS, HAVING A SPECIFIC GRAVITY OF LESS THAN 0.94",39,1793,Plastics & Rubber,Manufactured Goods,2023-01-01 11:29:20
390190,OTHR POLYMERSOF ETHYLINE IN PRIMARY FORMS,39,1794,Plastics & Rubber,Manufactured Goods,2023-01-01 11:29:25
390210,POLYPROPYLENE,39,1795,Plastics & Rubber,Manufactured Goods,2023-01-01 11:29:30
390220,POLYISOBYTYLENE,39,1796,Plastics & Rubber,Manufactured Goods,2023-01-01 11:29:35
390230,PROPYLENE COPOLYMERS,39,1797,Plastics & Rubber,Manufactured Goods,2023-01-01 11:29:40
390290,OTHR POLYMERS OF PROPYLENE IN PRMRY FORMS,39,1798,Plastics & Rubber,Manufactured Goods,2023-01-01 11:29:45
390311,EXPANSIBLE POLYSTERENE,39,1799,Plastics & Rubber,Manufactured Goods,2023-01-01 11:29:50
390319,OTHER POLYSTYRENE,39,1800,Plastics & Rubber,Manufactured Goods,2023-01-01 11:29:55
390320,STYRENE ACRYLONITRILE (SAN) COPOLYMERS,39,1801,Plastics & Rubber,Manufactured Goods,2023-01-01 11:30:00
390330,ACRYLONITRILE-BUTADIENE STYRENE COPOLYMRS,39,1802,Plastics & Rubber,Manufactured Goods,2023-01-01 11:30:05
390390,OTHR POLYMRS OF STYRENE,39,1803,Plastics & Rubber,Manufactured Goods,2023-01-01 11:30:10
390410,"POLY (VINYL CHLORIDE), NOT MIXED WITH OTHR",39,1804,Plastics & Rubber,Manufactured Goods,2023-01-01 11:30:15
390421,OTHER POLYVINYL CHLORIDE NON-PLASTICISED,39,1805,Plastics & Rubber,Manufactured Goods,2023-01-01 11:30:20
390422,OTHER PLASTICISED POLYVINYL CHLORIDE,39,1806,Plastics & Rubber,Manufactured Goods,2023-01-01 11:30:25
390430,VINYL CHLORIDE-VINYL ACETATE COPOLYMERS,39,1807,Plastics & Rubber,Manufactured Goods,2023-01-01 11:30:30
390440,OTHER VINYL CHLORIDE COPOLYMERS,39,1808,Plastics & Rubber,Manufactured Goods,2023-01-01 11:30:35
390450,VINYLIDENE CLORIDE POLYMERS,39,1809,Plastics & Rubber,Manufactured Goods,2023-01-01 11:30:40
390461,POLYTETRAFLUOROETHYLENE,39,1810,Plastics & Rubber,Manufactured Goods,2023-01-01 11:30:45
390469,OTHER FLURO-POLYMERS,39,1811,Plastics & Rubber,Manufactured Goods,2023-01-01 11:30:50
390490,OTHER POLYMERS OF VINYL CHLORIDE OR OF    OTHER HALOGENATED OLEFINS IN PRIMARY FORMS,39,1812,Plastics & Rubber,Manufactured Goods,2023-01-01 11:30:55
390512,POLYVINYL ACETATE IN AQS DISPRSN,39,1813,Plastics & Rubber,Manufactured Goods,2023-01-01 11:31:00
390519,OTHER POLYMERS OF VINYL ACETATE,39,1814,Plastics & Rubber,Manufactured Goods,2023-01-01 11:31:05
390521,VNYL ACETT COPOLYMRS IN AQUEOUS DISPRSN,39,1815,Plastics & Rubber,Manufactured Goods,2023-01-01 11:31:10
390529,VNYL ACETT COPOLYMR EXCL IN AQOUS DISPRSN,39,1816,Plastics & Rubber,Manufactured Goods,2023-01-01 11:31:15
390530,PV ALCHL W/N CNTNG UNHYDROLYED ACTATE GRPS,39,1817,Plastics & Rubber,Manufactured Goods,2023-01-01 11:31:20
390591,COPOLYMERS,39,1818,Plastics & Rubber,Manufactured Goods,2023-01-01 11:31:25
390599,OTHER VINYL ESTERS AND VINYL POLYMERS,39,1819,Plastics & Rubber,Manufactured Goods,2023-01-01 11:31:30
390610,POLYMETHYL METHACRYLATE,39,1820,Plastics & Rubber,Manufactured Goods,2023-01-01 11:31:35
390690,OTHER ACRYLIC POLYMERS (EXCL METHACRYLATE),39,1821,Plastics & Rubber,Manufactured Goods,2023-01-01 11:31:40
390710,POLYACETALS,39,1822,Plastics & Rubber,Manufactured Goods,2023-01-01 11:31:45
390721,BIS (POLYOXYETHYLENE) METHYL PHOSPHONATE,39,1823,Plastics & Rubber,Manufactured Goods,2023-01-01 11:31:50
390729,OTHER,39,1824,Plastics & Rubber,Manufactured Goods,2023-01-01 11:31:55
390730,EPOXIDE RESINS,39,1825,Plastics & Rubber,Manufactured Goods,2023-01-01 11:32:00
390740,POLYCARBONATES,39,1826,Plastics & Rubber,Manufactured Goods,2023-01-01 11:32:05
390750,ALKYD RESINS,39,1827,Plastics & Rubber,Manufactured Goods,2023-01-01 11:32:10
390761,POLY(ETHYLENE TEREPHTHALATE): HAVING A VISCOSITY NUMBER OF 78 ML/G OR HIGHER,39,1828,Plastics & Rubber,Manufactured Goods,2023-01-01 11:32:15
390769,OTHER: POLY(ETHYLENE TEREPHTHALATE),39,1829,Plastics & Rubber,Manufactured Goods,2023-01-01 11:32:20
390770,POLY (LACTIC ACID),39,1830,Plastics & Rubber,Manufactured Goods,2023-01-01 11:32:25
390791,OTHER POLYESTERS UNSATURATED,39,1831,Plastics & Rubber,Manufactured Goods,2023-01-01 11:32:30
390799,OTHER POLYESTERS (SATURATED),39,1832,Plastics & Rubber,Manufactured Goods,2023-01-01 11:32:35
390810,"POLYAMIDE -6,-11,-12,-6,6,-6,9,-6,10/-6,12",39,1833,Plastics & Rubber,Manufactured Goods,2023-01-01 11:32:40
390890,OTHER POLYAMIDES,39,1834,Plastics & Rubber,Manufactured Goods,2023-01-01 11:32:45
390910,UREA RESINS THIOUREA RESINS,39,1835,Plastics & Rubber,Manufactured Goods,2023-01-01 11:32:50
390920,MELAMINE RESINS:,39,1836,Plastics & Rubber,Manufactured Goods,2023-01-01 11:32:55
390931,"POLY(METHYLENE PHENYL ISOCYANATE) (CRUDE MDI, POLYMERIC MDI)",39,1837,Plastics & Rubber,Manufactured Goods,2023-01-01 11:33:00
390939,OTHER:,39,1838,Plastics & Rubber,Manufactured Goods,2023-01-01 11:33:05
390940,PHENOLIC RESINS,39,1839,Plastics & Rubber,Manufactured Goods,2023-01-01 11:33:10
390950,POLYURETHANES,39,1840,Plastics & Rubber,Manufactured Goods,2023-01-01 11:33:15
391000,SILICONS IN PRIMARY FORMS,39,1841,Plastics & Rubber,Manufactured Goods,2023-01-01 11:33:20
391110,PETROLEUM RESINS COUMARONE INDENE OR      COUMARONE-INDENE RESINS AND POLYTERPENES,39,1842,Plastics & Rubber,Manufactured Goods,2023-01-01 11:33:25
391120,"POLY (1,3-PHENYLENE METHYLPHOSPHONATE)",39,1843,Plastics & Rubber,Manufactured Goods,2023-01-01 11:33:30
391190,OTHER PRODUCTS IN RIMARY FORMS,39,1844,Plastics & Rubber,Manufactured Goods,2023-01-01 11:33:35
391211,CELLULOSE ACETATES-NON-PLASTICISED,39,1845,Plastics & Rubber,Manufactured Goods,2023-01-01 11:33:40
391212,CELLULOSE ACETATES PLASTICISED,39,1846,Plastics & Rubber,Manufactured Goods,2023-01-01 11:33:45
391220,CELLULOSE NITRATES(INCLUDNG COLLODIONS),39,1847,Plastics & Rubber,Manufactured Goods,2023-01-01 11:33:50
391231,CARBOXYMETHYLCELLULOSE AND ITS SALTS,39,1848,Plastics & Rubber,Manufactured Goods,2023-01-01 11:33:55
391239,OTHER : -,39,1849,Plastics & Rubber,Manufactured Goods,2023-01-01 11:34:00
391290,OTHER CELLULOSE AND ITS CHEMICAL DERIVATIVES,39,1850,Plastics & Rubber,Manufactured Goods,2023-01-01 11:34:05
391310,ALGINIC ACID ITS SALTS AND ESTERS,39,1851,Plastics & Rubber,Manufactured Goods,2023-01-01 11:34:10
391390,OTHER NATRL AND MODFD NATRL POLYMERS,39,1852,Plastics & Rubber,Manufactured Goods,2023-01-01 11:34:15
391400,"ION EXCHANGERS BASED ON POLYMERS OF       HEADING 3901 TO 3913, IN PRIMARY FORMS",39,1853,Plastics & Rubber,Manufactured Goods,2023-01-01 11:34:20
391510,WSTE PARINGS AND SCRAP OF PLYMRS OF ETHYLENE,39,1854,Plastics & Rubber,Manufactured Goods,2023-01-01 11:34:25
391520,WASTE PARINGS AND SCRAP OF POLYMRS OF STYREN,39,1855,Plastics & Rubber,Manufactured Goods,2023-01-01 11:34:30
391530,WASTE PARINGS AND SCRAP OF P.V.C.,39,1856,Plastics & Rubber,Manufactured Goods,2023-01-01 11:34:35
391590,WASTE PARINGS AND SCRAP OF OTHR PLASTIC,39,1857,Plastics & Rubber,Manufactured Goods,2023-01-01 11:34:40
391610,"MONOFIL,RODS,STICKS ETC OF POLYETHYLENE",39,1858,Plastics & Rubber,Manufactured Goods,2023-01-01 11:34:45
391620,MONOFIL ROD ETC OF POLMRS OF VINYL CHLRIDE,39,1859,Plastics & Rubber,Manufactured Goods,2023-01-01 11:34:50
391690,"MONOFIL,RODS,STICKS ETC. OF OTHR PLSTCS",39,1860,Plastics & Rubber,Manufactured Goods,2023-01-01 11:34:55
391710,ARTFCL GUTS OF HRDND PRTN/OF CELULSC MTRLS,39,1861,Plastics & Rubber,Manufactured Goods,2023-01-01 11:35:00
391721,TUBES PIPES AND HOSES OF POLYETHYLNE RIGID,39,1862,Plastics & Rubber,Manufactured Goods,2023-01-01 11:35:05
391722,TUBES PIPES AND HOSES OF PLYMRS OF PROPYLENE,39,1863,Plastics & Rubber,Manufactured Goods,2023-01-01 11:35:10
391723,TUBES PIPES AND HOSES OF POLYVINYL CHLORDE,39,1864,Plastics & Rubber,Manufactured Goods,2023-01-01 11:35:15
391729,TUBES PIPES AND HOSES OF OTHR PLSTCS RIGID,39,1865,Plastics & Rubber,Manufactured Goods,2023-01-01 11:35:20
391731,FLEXIBLE TUBES PIPES AND HOSES HAVING A   MINIMUM BURST PRESSURE OF 27.6 MPA,39,1866,Plastics & Rubber,Manufactured Goods,2023-01-01 11:35:25
391732,TUBES PIPES AND HOSES REINFORCED/OTHRWISE   COMBINED WITH OTHR MATRLS WITHOUT FITTNGS,39,1867,Plastics & Rubber,Manufactured Goods,2023-01-01 11:35:30
391733,TUBES PIPES AND HOSES NT REINFORCED/OTHRWISECOMBINED WITH OTHR MATRLS WITH FITTINGS,39,1868,Plastics & Rubber,Manufactured Goods,2023-01-01 11:35:35
391739,OTHR TUBES PIPES AND HOSES,39,1869,Plastics & Rubber,Manufactured Goods,2023-01-01 11:35:40
391740,FITTINGS FOR TUBES PIPES AND HOSES OF PLSTC,39,1870,Plastics & Rubber,Manufactured Goods,2023-01-01 11:35:45
391810,FLR CVRNGS ETC OF PLYMRS OF VNYL CHLORIDE,39,1871,Plastics & Rubber,Manufactured Goods,2023-01-01 11:35:50
391890,FLOOR COVERING OF OTHER PLASTICS,39,1872,Plastics & Rubber,Manufactured Goods,2023-01-01 11:35:55
391910,"SELF-ADHSV PLTS ETC IN RLS,WDTH < = 20CM",39,1873,Plastics & Rubber,Manufactured Goods,2023-01-01 11:36:00
391990,OTHER SELF-ADHSV PLTS ETC,39,1874,Plastics & Rubber,Manufactured Goods,2023-01-01 11:36:05
392010,PLATES SHEETS ETC.OF POLYMRS OF ETHYLENE,39,1875,Plastics & Rubber,Manufactured Goods,2023-01-01 11:36:10
392020,PLTES SHTS ETC. OF POLYMRS OF PROPYLN,39,1876,Plastics & Rubber,Manufactured Goods,2023-01-01 11:36:15
392030,PLTES SHTS ETC. OF POLYMRS OF STYRENE,39,1877,Plastics & Rubber,Manufactured Goods,2023-01-01 11:36:20
392043,PLTES SHTS ETC OF POLYMRS OF VINYL CHLORIDCONT. BY WEIGHT >= 6% OF PLASTICIZERS,39,1878,Plastics & Rubber,Manufactured Goods,2023-01-01 11:36:25
392049,OTHR PLTES SHTS OF POLYMR OF VINYL CHLORID,39,1879,Plastics & Rubber,Manufactured Goods,2023-01-01 11:36:30
392051,PLTES SHTS ETC OF PLYMTHYL METHACRYLTE,39,1880,Plastics & Rubber,Manufactured Goods,2023-01-01 11:36:35
392059,SHETS ETC OF OTHR ACRYLIC POLYMERS,39,1881,Plastics & Rubber,Manufactured Goods,2023-01-01 11:36:40
392061,PLTES SHTS ETC OF PLYCRBNTS,39,1882,Plastics & Rubber,Manufactured Goods,2023-01-01 11:36:45
392062,PLTES SHTS ETC OF PLYETHYLN TEREPHTHALTE,39,1883,Plastics & Rubber,Manufactured Goods,2023-01-01 11:36:50
392063,PLTES SHTS ETC OF UNSATURATED POLYESTERS,39,1884,Plastics & Rubber,Manufactured Goods,2023-01-01 11:36:55
392069,PLTES SHTS ETC OF OTHR POLYESTERS,39,1885,Plastics & Rubber,Manufactured Goods,2023-01-01 11:37:00
392071,PLTES SHTS ETC OF REGENERATED CELLULSE,39,1886,Plastics & Rubber,Manufactured Goods,2023-01-01 11:37:05
392073,PLTES SHTS ETC OF CELLULOSE ACETATE,39,1887,Plastics & Rubber,Manufactured Goods,2023-01-01 11:37:10
392079,OTHR PLTES SHTS ETC OF OTHR CELULSE DRVTVS,39,1888,Plastics & Rubber,Manufactured Goods,2023-01-01 11:37:15
392091,OTHR PLTES SHTS ETCOF OTHER PLASTICS:,39,1889,Plastics & Rubber,Manufactured Goods,2023-01-01 11:37:20
392092,OTHR PLTES SHTS ETC OF POLAMIDES,39,1890,Plastics & Rubber,Manufactured Goods,2023-01-01 11:37:25
392093,OTHR PLTES SHTS ETC OF AMINO-RESINS,39,1891,Plastics & Rubber,Manufactured Goods,2023-01-01 11:37:30
392094,OTHR PLTES SHTS ETC OF PHENOLIC RESINS,39,1892,Plastics & Rubber,Manufactured Goods,2023-01-01 11:37:35
392099,PLATES SHEETS ETC OF OTHR PLASTICS,39,1893,Plastics & Rubber,Manufactured Goods,2023-01-01 11:37:40
392111,PLTES SHTS ETC OF POLYMRS OF STYRENE,39,1894,Plastics & Rubber,Manufactured Goods,2023-01-01 11:37:45
392112,PLTES ETC OF POLYMRS OF VINYL CHLORDE,39,1895,Plastics & Rubber,Manufactured Goods,2023-01-01 11:37:50
392113,PLTES ETC OF POLYURETHANES,39,1896,Plastics & Rubber,Manufactured Goods,2023-01-01 11:37:55
392114,PLTES ETC OF REGNRTD CELULSE,39,1897,Plastics & Rubber,Manufactured Goods,2023-01-01 11:38:00
392119,OTHR PLTES SHTS ETC OF OTHR PLSTCS CELULR,39,1898,Plastics & Rubber,Manufactured Goods,2023-01-01 11:38:05
392190,"OTHR PLTS,SHTS,FILM FOIL,STRIP ETC,NONCLLR",39,1899,Plastics & Rubber,Manufactured Goods,2023-01-01 11:38:10
392210,BATHS SHOWER-BATHS AND WASH-BASINS,39,1900,Plastics & Rubber,Manufactured Goods,2023-01-01 11:38:15
392220,LAVATORY SEATS AND COVERS,39,1901,Plastics & Rubber,Manufactured Goods,2023-01-01 11:38:20
392290,OTHR SANITARY ARTICLES,39,1902,Plastics & Rubber,Manufactured Goods,2023-01-01 11:38:25
392310,BOXS CASES CRATES AND SMLR ARTCLS OF PLSTCS,39,1903,Plastics & Rubber,Manufactured Goods,2023-01-01 11:38:30
392321,SACKS AND BAGS OF POLYETHYLENE (INCL CONES),39,1904,Plastics & Rubber,Manufactured Goods,2023-01-01 11:38:35
392329,SACKS AND BAGS (INCL CONES)OF OTHR PLASTICS,39,1905,Plastics & Rubber,Manufactured Goods,2023-01-01 11:38:40
392330,CRBYS BTTLS FLSKS AND SMLR ARTCLS OF PLSTCS,39,1906,Plastics & Rubber,Manufactured Goods,2023-01-01 11:38:45
392340,SPLS COPS BOBBINS AND SMLR SPPRTS OF PLSTCS,39,1907,Plastics & Rubber,Manufactured Goods,2023-01-01 11:38:50
392350,STOPRS LIDS CAPS AND OTHR CLSRES OF PLSTCS,39,1908,Plastics & Rubber,Manufactured Goods,2023-01-01 11:38:55
392390,OTHR ARTCLS FOR THE CNVYNCE/PCKNG OF GOODS,39,1909,Plastics & Rubber,Manufactured Goods,2023-01-01 11:39:00
392410,TABLEWARE AND KITCHENWARE OF PLASTICS,39,1910,Plastics & Rubber,Manufactured Goods,2023-01-01 11:39:05
392490,OTHR HOUSEHOLD AND TOILT ARTCLS OF PLSTCS,39,1911,Plastics & Rubber,Manufactured Goods,2023-01-01 11:39:10
392510,RESRVRS TANKS VATS AND SMLR CONTNR UPTO 300L,39,1912,Plastics & Rubber,Manufactured Goods,2023-01-01 11:39:15
392520,DOORS WNDOWS AND THR FRMS THRSHLDS FOR DOORS,39,1913,Plastics & Rubber,Manufactured Goods,2023-01-01 11:39:20
392530,SHUTTERS BLINDS(INCLUDING VENETIAN BLINDS)AND SIMILAR ARTICLES AND PARTS THEREOF,39,1914,Plastics & Rubber,Manufactured Goods,2023-01-01 11:39:25
392590,OTHER BUILDERS WARE OF PLASTICS,39,1915,Plastics & Rubber,Manufactured Goods,2023-01-01 11:39:30
392610,ARTICLS OF OFFICE OR SCHOOL SUPPLIES,39,1916,Plastics & Rubber,Manufactured Goods,2023-01-01 11:39:35
392620,ARTCLS OF APRL AND CLTHNG ACSORS(INCL GLVS),39,1917,Plastics & Rubber,Manufactured Goods,2023-01-01 11:39:40
392630,FITTINGS FOR FURNITURE COACHWORK/THE LIKE,39,1918,Plastics & Rubber,Manufactured Goods,2023-01-01 11:39:45
392640,STATUETTES AND OTHER ORNAMENTAL ARTICLES,39,1919,Plastics & Rubber,Manufactured Goods,2023-01-01 11:39:50
392690,OTHER ARTICLES OF PLASTICS,39,1920,Plastics & Rubber,Manufactured Goods,2023-01-01 11:39:55
400110,NATRL RUBR LATEX W/N PRE-VULCANISED,40,1921,Plastics & Rubber,Manufactured Goods,2023-01-01 11:40:00
400121,NATRL RUBR IN SMKD SHEETS,40,1922,Plastics & Rubber,Manufactured Goods,2023-01-01 11:40:05
400122,TECHNICALLY SPCFD NATRL RUBR(TSNR),40,1923,Plastics & Rubber,Manufactured Goods,2023-01-01 11:40:10
400129,NATURAL RUBBER IN OTHER FORMS,40,1924,Plastics & Rubber,Manufactured Goods,2023-01-01 11:40:15
400130,BALTA GUTTA-PERCHA ETC AND SMLR NATRL GUMS,40,1925,Plastics & Rubber,Manufactured Goods,2023-01-01 11:40:20
400211,LATEX (SBR/XSBR),40,1926,Plastics & Rubber,Manufactured Goods,2023-01-01 11:40:25
400219,OTHR STYRENE-BUTADIENE RUBR(SBR)          CRBOXLATED STYRENE-BUTADIENE RUBR(XSBR),40,1927,Plastics & Rubber,Manufactured Goods,2023-01-01 11:40:30
400220,BUTADIENE RUBBER (BR),40,1928,Plastics & Rubber,Manufactured Goods,2023-01-01 11:40:35
400231,ISOBUTENE-ISOPRENE(BUTYL) RUBBER (IIR),40,1929,Plastics & Rubber,Manufactured Goods,2023-01-01 11:40:40
400239,HALO-ISOBUTENE-ISOPRENE RUBR (CIIR/BIIR),40,1930,Plastics & Rubber,Manufactured Goods,2023-01-01 11:40:45
400241,"LATEX,CHLOROPRENE RUBR",40,1931,Plastics & Rubber,Manufactured Goods,2023-01-01 11:40:50
400249,OTHR CHLOROPRENE(CHLOROBUTADIENE) RUBR(CR),40,1932,Plastics & Rubber,Manufactured Goods,2023-01-01 11:40:55
400251,ACRYLONITRILE-BUTADINE RUBR LATEX,40,1933,Plastics & Rubber,Manufactured Goods,2023-01-01 11:41:00
400259,OTHR ACRYLONITRILE-BUTADIENE RUBR (NBR),40,1934,Plastics & Rubber,Manufactured Goods,2023-01-01 11:41:05
400260,ISOPRENE RUBBER,40,1935,Plastics & Rubber,Manufactured Goods,2023-01-01 11:41:10
400270,ETHYLENE-PRPYLENE-NON-CONJUGATED,40,1936,Plastics & Rubber,Manufactured Goods,2023-01-01 11:41:15
400280,MXTRS OF ANY PRDCT OF HDG NO 4001         WTH ANY PRDCT OF THIS HDG,40,1937,Plastics & Rubber,Manufactured Goods,2023-01-01 11:41:20
400291,OTHR RUBER LATEX,40,1938,Plastics & Rubber,Manufactured Goods,2023-01-01 11:41:25
400299,OTHR SYNTHTC AND FACTICE RBR DRVD FRM OILS,40,1939,Plastics & Rubber,Manufactured Goods,2023-01-01 11:41:30
400300,RECLAIMED RUBR IN PRMRY FORMS             OR IN PLATES SHEETS OR STRIP,40,1940,Plastics & Rubber,Manufactured Goods,2023-01-01 11:41:35
400400,"WASTE,PARINGS AND SCRAP OF RUBR(BESIDES HARDRUBR) AND PWDR 9 GRNLS OBTAINED THEREFROM",40,1941,Plastics & Rubber,Manufactured Goods,2023-01-01 11:41:40
400510,RUBR COMPOUNDED WTH CRBN BLACKS/SILICA,40,1942,Plastics & Rubber,Manufactured Goods,2023-01-01 11:41:45
400520,SOLUTIONS; DISPRSNS OTHR THN THOSE OF     SUBHEADING NO. 400510,40,1943,Plastics & Rubber,Manufactured Goods,2023-01-01 11:41:50
400591,PLATES SHEETS AND STRIP,40,1944,Plastics & Rubber,Manufactured Goods,2023-01-01 11:41:55
400599,OTHR CMPNDED UNVULCNSD RUBR EXCL PLTS SHTS,40,1945,Plastics & Rubber,Manufactured Goods,2023-01-01 11:42:00
400610,"""CAMEL-BLACK STRPS FR RETREADING RUBR TY",40,1946,Plastics & Rubber,Manufactured Goods,2023-01-01 11:42:05
400690,OTHR FORMS AND ARTICLES OF UNVULCNSD RUBR,40,1947,Plastics & Rubber,Manufactured Goods,2023-01-01 11:42:10
400700,VULCANISED RUBR THREAD AND CORD,40,1948,Plastics & Rubber,Manufactured Goods,2023-01-01 11:42:15
400811,"PLTS,SHTS,STRP OF CELLULAR RUBBER",40,1949,Plastics & Rubber,Manufactured Goods,2023-01-01 11:42:20
400819,OTHRS OF CELLULAR RUBBER,40,1950,Plastics & Rubber,Manufactured Goods,2023-01-01 11:42:25
400821,PLTS SHTS STRPS OF NON-CELLULAR RUBR,40,1951,Plastics & Rubber,Manufactured Goods,2023-01-01 11:42:30
400829,OTHRS OF NON-CELLULAR RUBBER,40,1952,Plastics & Rubber,Manufactured Goods,2023-01-01 11:42:35
400911,"TUBES,PIPES AND HOSES OF VULCNSD RUBR NOT   REINFORCED/OTHRWSE COMBINED WTH           OTHR MATERIALS WITHOUT FITTINGS",40,1953,Plastics & Rubber,Manufactured Goods,2023-01-01 11:42:40
400912,"TUBES,PIPES AND HOSES OF VULCMSD RUBR NOT    REINFORCED/OTHERWSE COMBINED WITH OTHER  MATERIALS WITH FITTINGS",40,1954,Plastics & Rubber,Manufactured Goods,2023-01-01 11:42:45
400921,"TUBES,PIPES AND HOSES OF VULCNSD RUBR       REINFORCED/OTHRWSE CMBND ONLY WTH         METAL MATERIALS WITHOUT FITTINGS",40,1955,Plastics & Rubber,Manufactured Goods,2023-01-01 11:42:50
400922,"TUBES,PIPES AND HOSES OF VULCNSD RUBR       REINFORCED/OTHERWSE CMBND ONLY WITH METAL WITH FITTINGS",40,1956,Plastics & Rubber,Manufactured Goods,2023-01-01 11:42:55
400931,"TUBES, PIPES AND HOSES OF VULCNSD RUBR      REINFORCED/OTHRWSE CMBND ONLY WTH         TEXTILE MATERIALS WTHOUT FITTINGS",40,1957,Plastics & Rubber,Manufactured Goods,2023-01-01 11:43:00
400932,"TUBES,PIPES AND HOSES OF VULCNSD RUBR       REINFORCED/OTHERWSE CMBND ONLY WITH       TEXTILES MATERIALS WITH FITTINGS",40,1958,Plastics & Rubber,Manufactured Goods,2023-01-01 11:43:05
400941,TUBES.PIPES AND HOSES OF VULCNSD RUBR       REINFORCED/OTHRWSE COMBINED WTH           OTHR MATERIALS WITHOUT FITTINGS,40,1959,Plastics & Rubber,Manufactured Goods,2023-01-01 11:43:10
400942,"TUBES,PIPES,ANDHOSES OF VULCNSD RUBR        REINFORCED OTHERWSE COMBINED WITH OTHER   MATARIALS WITH FITTINGS",40,1960,Plastics & Rubber,Manufactured Goods,2023-01-01 11:43:15
401011,(CNVYR BLT/BLTNG )RENFRCD ONLY WITH METL,40,1961,Plastics & Rubber,Manufactured Goods,2023-01-01 11:43:20
401012,(CNVYR BLT/BLTNG)RENFRCD WTH TXTL MTRLS,40,1962,Plastics & Rubber,Manufactured Goods,2023-01-01 11:43:25
401019,OTHR CONVEYOR BELT OR BELTING,40,1963,Plastics & Rubber,Manufactured Goods,2023-01-01 11:43:30
401031,"ENDLESS TRNSMSN BLT/BLTNG OF TRAPEZOIDAL  CROS_SECTN(V-BELT),V-RIBBED OF CIRCUMFRNS BETWN",40,1964,Plastics & Rubber,Manufactured Goods,2023-01-01 11:43:35
401032,"ENDLESS TRNSMSN BLT/BLTNG OF TRAPEZOIDAL  CROS-SECTION(V-BLT),OTHER THAN V-RIBBED OFCIRCUM BETWN 60 CM AND 180 CM.",40,1965,Plastics & Rubber,Manufactured Goods,2023-01-01 11:43:40
401033,"ENDLESS TRNSMSN BLT/BLTNG OF TRAPEZOIDAL CROS-SECTN(V-BLT(,V-RIBBED OF CIRCUMFRNS   BETWN 60 CM AND 180 CM",40,1966,Plastics & Rubber,Manufactured Goods,2023-01-01 11:43:45
401034,"ENDLESS TRNSMSN BLT/BLTNG OF TRAPEZOIDAL CROS-SECTN(V-BLT), OTHER THAN V-RIBBED OF  CIRCUM BETWN 180 CM AND 240 CM.",40,1967,Plastics & Rubber,Manufactured Goods,2023-01-01 11:43:50
401035,"ENDLESS SYNCHRONOUS BELTS,OF A CIRCUMFRNCEBETWN 60CM AND 150CM",40,1968,Plastics & Rubber,Manufactured Goods,2023-01-01 11:43:55
401036,"ENDLESS SYNCHRONOUS BLTS, OF A CIRCUMFRNCEBETWN 150CM AND 198 CM",40,1969,Plastics & Rubber,Manufactured Goods,2023-01-01 11:44:00
401039,OTHR TRANSMISSION  BLTS/BELTING OF        VULCANISED RUBBER,40,1970,Plastics & Rubber,Manufactured Goods,2023-01-01 11:44:05
401110,NEW PNMTC TYRES OF A KND USED ON MOTOR    CARS(INCL STATION WAGONS AND RACING CARS,40,1971,Plastics & Rubber,Manufactured Goods,2023-01-01 11:44:10
401120,NEW PNMTC TYRES USED ON BUSES/LORRIES,40,1972,Plastics & Rubber,Manufactured Goods,2023-01-01 11:44:15
401130,NEW PNMTC TYRES OF A KIND USED ON AIRCRAFT,40,1973,Plastics & Rubber,Manufactured Goods,2023-01-01 11:44:20
401140,NEW PNMTC TYRES OF A KIND USED ON MTRCYCLS,40,1974,Plastics & Rubber,Manufactured Goods,2023-01-01 11:44:25
401150,NEW PNMTC TYRES OF A KND USED ON BICYCLS,40,1975,Plastics & Rubber,Manufactured Goods,2023-01-01 11:44:30
401170,OF A KIND USED ON AGRICULTURAL OR FORESTRY VEHICLES AND MACHINES,40,1976,Plastics & Rubber,Manufactured Goods,2023-01-01 11:44:35
401180,"OF A KIND USED ON CONSTRUCTION, MINING OR INDUSTRIAL HANDLING VEHICLES AND MACHINES",40,1977,Plastics & Rubber,Manufactured Goods,2023-01-01 11:44:40
401190,OTHER,40,1978,Plastics & Rubber,Manufactured Goods,2023-01-01 11:44:45
401211,RETREADED TYRE USED ON MOTOR CARS(INCL    STATATION WAGON/RACING CARS),40,1979,Plastics & Rubber,Manufactured Goods,2023-01-01 11:44:50
401212,RETREADED TYRE USED 0ON BUSES/LORRIES,40,1980,Plastics & Rubber,Manufactured Goods,2023-01-01 11:44:55
401213,RETREADED TYRE USED ON AIRCRAFTS,40,1981,Plastics & Rubber,Manufactured Goods,2023-01-01 11:45:00
401219,RETREADED TYRE USED ON VEHICLE OTHER THAN MOTOR CARS/BUSES/LORRIES/AIRCRAFTS,40,1982,Plastics & Rubber,Manufactured Goods,2023-01-01 11:45:05
401220,USED PNEUMATIC TYRES,40,1983,Plastics & Rubber,Manufactured Goods,2023-01-01 11:45:10
401290,"OTHER SOLID/CUSHION TYRES,TYRE TREADS AND   TYRE FLAPS OF RUBBER",40,1984,Plastics & Rubber,Manufactured Goods,2023-01-01 11:45:15
401310,INNER TUBES OF MTR CARS (INCL STATION     WAGONS AND RACING CARS) BUSES /LORIES,40,1985,Plastics & Rubber,Manufactured Goods,2023-01-01 11:45:20
401320,INNER TUBES OF RUBBER USED ON BICYCLES,40,1986,Plastics & Rubber,Manufactured Goods,2023-01-01 11:45:25
401390,OTHER INNER TUBES OF RUBBER,40,1987,Plastics & Rubber,Manufactured Goods,2023-01-01 11:45:30
401410,SHEATH CONTRACEPTIVES,40,1988,Plastics & Rubber,Manufactured Goods,2023-01-01 11:45:35
401490,OTHR HYGNC AND PHRMCTL ARTCLS,40,1989,Plastics & Rubber,Manufactured Goods,2023-01-01 11:45:40
401512,"OF A KIND USED FOR MEDICAL, SURGICAL, DENTAL OR VETERINARY PURPOSES",40,1990,Plastics & Rubber,Manufactured Goods,2023-01-01 11:45:45
401519,"OTHER GLOVES,MITTENS AND MITTS",40,1991,Plastics & Rubber,Manufactured Goods,2023-01-01 11:45:50
401590,OTHR ARTCLS OF APARL AND CLTHNG ACSRS OF    VOLCANISED RUBR,40,1992,Plastics & Rubber,Manufactured Goods,2023-01-01 11:45:55
401610,OTHR ARTCLS OF CELLULAR RUBBER,40,1993,Plastics & Rubber,Manufactured Goods,2023-01-01 11:46:00
