HSCode,Commodity,HS2,Product_ID,Industry_Category,Product_Type,Created_At
720221,FERRO-SILICON CONTNG>55% OF SILICON,72,3378,Base Metals & Articles,Industrial Goods,2023-01-01 13:41:25
720229,OTHER FERRO-SILICON,72,3379,Base Metals & Articles,Industrial Goods,2023-01-01 13:41:30
720230,FERRO-SILICO-MANGANESE,72,3380,Base Metals & Articles,Industrial Goods,2023-01-01 13:41:35
720241,FERRO-CHROMIUM CARBON CONTNG>4% BY WT,72,3381,Base Metals & Articles,Industrial Goods,2023-01-01 13:41:40
720249,OTHER FERRO-CHROMIUM,72,3382,Base Metals & Articles,Industrial Goods,2023-01-01 13:41:45
720250,FERRO-SILICO-CHROMIUM,72,3383,Base Metals & Articles,Industrial Goods,2023-01-01 13:41:50
720260,FERRO-NICKEL,72,3384,Base Metals & Articles,Industrial Goods,2023-01-01 13:41:55
720270,FERRO-MOLYBDENUM,72,3385,Base Metals & Articles,Industrial Goods,2023-01-01 13:42:00
720280,FERRO-TUNGSTEN AND FERRO-SILICO-TUNGSTEN,72,3386,Base Metals & Articles,Industrial Goods,2023-01-01 13:42:05
720291,FERROTITANIUM AND FERRO-SILICO-TITAMIUM,72,3387,Base Metals & Articles,Industrial Goods,2023-01-01 13:42:10
720292,FERRO-VANADIUM,72,3388,Base Metals & Articles,Industrial Goods,2023-01-01 13:42:15
720293,FERRO-NIOBIUM,72,3389,Base Metals & Articles,Industrial Goods,2023-01-01 13:42:20
720299,OTHER FERRO-ALLOYS,72,3390,Base Metals & Articles,Industrial Goods,2023-01-01 13:42:25
720310,FERS PRDCT OBTND BY DRCT RDCTN OF IRON ORE,72,3391,Base Metals & Articles,Industrial Goods,2023-01-01 13:42:30
720390,"OTHR FERS PRDCTS AND IRON IN PLLTS,LUMPS ETC",72,3392,Base Metals & Articles,Industrial Goods,2023-01-01 13:42:35
720410,WASTE AND SCRAP OF CAST IRON,72,3393,Base Metals & Articles,Industrial Goods,2023-01-01 13:42:40
720421,WASTE AND SCRAP OF STAINLESS STEEL,72,3394,Base Metals & Articles,Industrial Goods,2023-01-01 13:42:45
720429,WASTE AND SCRAP OF OTHER ALLOY STEEL,72,3395,Base Metals & Articles,Industrial Goods,2023-01-01 13:42:50
720430,WASTE AND SCRAP OF TINNED IRON OR STEEL,72,3396,Base Metals & Articles,Industrial Goods,2023-01-01 13:42:55
720441,"TURNGS,SHVNGS,CHPS,MILNG WST,SWDST,FILNGS TRMMNGS AND STMPNGS,W/N IN BUNDLES",72,3397,Base Metals & Articles,Industrial Goods,2023-01-01 13:43:00
720449,OTHER WASTE AND SCRAP,72,3398,Base Metals & Articles,Industrial Goods,2023-01-01 13:43:05
720450,REMELTING SCRAP INGOTS,72,3399,Base Metals & Articles,Industrial Goods,2023-01-01 13:43:10
720510,GRANULES OF PIG IRON ETC.,72,3400,Base Metals & Articles,Industrial Goods,2023-01-01 13:43:15
720521,POWDERS OF ALLOY STEEL,72,3401,Base Metals & Articles,Industrial Goods,2023-01-01 13:43:20
720529,POWDERS OF OTHER IRON/STEEL ETC.,72,3402,Base Metals & Articles,Industrial Goods,2023-01-01 13:43:25
720610,INGOTS,72,3403,Base Metals & Articles,Industrial Goods,2023-01-01 13:43:30
720690,OTHR IRON/NON-ALLOY STEEL IN PRIMARY FORMS,72,3404,Base Metals & Articles,Industrial Goods,2023-01-01 13:43:35
720711,"PRDCTS CONTNG BY WT<0.25% CRBN,OF RCTNGLR (INCL SQR)CRS-SCTN;WDTH<TWICE THE THCKNS",72,3405,Base Metals & Articles,Industrial Goods,2023-01-01 13:43:40
720712,"OTHER, OF RECTANGULAR (OTHER THAN SQUARE) CROSS-SECTION :",72,3406,Base Metals & Articles,Industrial Goods,2023-01-01 13:43:45
720719,OTHR PRDCTS CONTNG BY WT<0.25% OF CARBON,72,3407,Base Metals & Articles,Industrial Goods,2023-01-01 13:43:50
720720,PRDCTS CONTNG BY WT>=0.25% OF CARBON,72,3408,Base Metals & Articles,Industrial Goods,2023-01-01 13:43:55
720810,"FLAT-ROLD PRODUCTS, IN COILS NT FURTHER   WORKED THN HOT-ROLD WTH PATRN IN RELIEF",72,3409,Base Metals & Articles,Industrial Goods,2023-01-01 13:44:00
720825,"FLAT-ROLD PRDCTS IN COILS OF A THCKNS>=   4.75 MM ONLY HOT-ROLD, PICKLD",72,3410,Base Metals & Articles,Industrial Goods,2023-01-01 13:44:05
720826,FLT-ROLD PRDCTS IN COILS OF A THCKNS>=3MM BUT <4.75 MM NT FRTHR WRKD THN HOT-ROLD   PICKLED,72,3411,Base Metals & Articles,Industrial Goods,2023-01-01 13:44:10
720827,FLT-ROLD PRDCTS IN COILS OF A THCKNS <3MM NT FRTHR WRKD THN HOT-ROLD PCKLD,72,3412,Base Metals & Articles,Industrial Goods,2023-01-01 13:44:15
720836,FLT-ROLD PRDCTS IN COILS OF A THCKNS >10MMNT FRTHR WRKD THN HT-ROLD EXCL PCKLD,72,3413,Base Metals & Articles,Industrial Goods,2023-01-01 13:44:20
720837,FLT-ROLD PRDCTS IN COILS OF A THCKNS >=   4.75MM BUT <10MM BUT NT FRTHR WRKD        THN HOT-ROLD EXCL PCKLD,72,3414,Base Metals & Articles,Industrial Goods,2023-01-01 13:44:25
720838,FLT-ROLD PRDCTS IN COILS OF A THCKNS>=3MM BUT <4.75 MM NT FRTHR WRKD THN HOT ROLD   EXCL PCKLD,72,3415,Base Metals & Articles,Industrial Goods,2023-01-01 13:44:30
720839,FLT-ROLD PRDCTS IN COILS OF A THCKNS OF   <3MM NT FRTHR WRKD THN HOT-ROLD EXCL PCKLD,72,3416,Base Metals & Articles,Industrial Goods,2023-01-01 13:44:35
720840,"FLT-ROLD PRDCTS NT IN COILS,NT FRTHR WRKD THN HOT ROLD WTH PATRNS IN RELIEF",72,3417,Base Metals & Articles,Industrial Goods,2023-01-01 13:44:40
720851,"FLT-ROLD PRDCTS, NOT IN COILS OF A THCKNS EXCD 10 MM NT FRTHR WRKD THN HT RLD PCKLD",72,3418,Base Metals & Articles,Industrial Goods,2023-01-01 13:44:45
720852,"FLAT-ROLD PRDCTS,NOT IN COILS OF A        THICKNESS>=4.75MM BUT <=10MM NOT          FURTHER WORKED THAN HOT-ROLD PICKLED",72,3419,Base Metals & Articles,Industrial Goods,2023-01-01 13:44:50
720853,"FLAT-ROLD PRDCTS,NOT IN COILS OF A        THICKNESS>=3MM BUT <4.75 MM, NOT          FURTHER WRKED THAN HOT-ROLD,PICKLED",72,3420,Base Metals & Articles,Industrial Goods,2023-01-01 13:44:55
720854,"FLT-ROLD PRDCTS, NT IN COILDS OF A THCKNS <3MM,NT FRTHR WRKD THN HT-ROLD, PICKLED",72,3421,Base Metals & Articles,Industrial Goods,2023-01-01 13:45:00
720890,"OTHR FLAT ROLLED PRODUCTS, N.E.S.",72,3422,Base Metals & Articles,Industrial Goods,2023-01-01 13:45:05
720915,"FLT-ROLD PRDCTS,IN COILS NT FRTHR WRKD THNCOLD-ROLD (COLD RDUCD)OF ATHCKNS>=3MM",72,3423,Base Metals & Articles,Industrial Goods,2023-01-01 13:45:10
720916,"FLT-ROLD PRDCTS,IN COILS NT FRTHR WRKD THNCOLD-ROLD (COLD RDUCD) OF THCKNS OF >1 MM BUT <3 MM",72,3424,Base Metals & Articles,Industrial Goods,2023-01-01 13:45:15
720917,"FLT-ROLD PRDCTS,IN COILS NT FRTHR WRKD THNCOLD-ROLD (COLD RDUCD) OF THCKNS OF       >=0.5 MM BUT <1 MM",72,3425,Base Metals & Articles,Industrial Goods,2023-01-01 13:45:20
720918,"FLT-ROLD PRDCTS,IN COILS NT FRTHR WRKD THNCOLD-ROLD (CLD RDUCD) OF THCKNS  <0.5 MM",72,3426,Base Metals & Articles,Industrial Goods,2023-01-01 13:45:25
720925,"FLT-ROLD PRODUCTS,NOT IN COILS,NOT        FURTHER WORKED THN COLD-ROLD(COLD RDUCED) OF A THICKNESS OF >=3 MM",72,3427,Base Metals & Articles,Industrial Goods,2023-01-01 13:45:30
720926,"FLAT-ROLD PRODUCTS,NOT IN COILS NOT FRTHR WRKD THN COLDROLD (COLD-REDUCED) OF A     THICKNESS>1 MM BUT <3 MM",72,3428,Base Metals & Articles,Industrial Goods,2023-01-01 13:45:35
720927,"FLAT-ROLD PRODUCTS,NOT IN COILS NOT       FURTHER WORKED THN COLD ROLD(COLD REDUCED)OF A THICKNESS>=0.5 MM BUT <1 MM",72,3429,Base Metals & Articles,Industrial Goods,2023-01-01 13:45:40
720928,"FLT-ROLD PRDCTS,NT IN COILS, NT FRTHR WRKDTHN COLD ROLD (CLD RDUCD),THCKNS <0.5MM",72,3430,Base Metals & Articles,Industrial Goods,2023-01-01 13:45:45
720990,OTHER FLAT ROLLED PRODUCTS N.E.S.,72,3431,Base Metals & Articles,Industrial Goods,2023-01-01 13:45:50
721011,PRDCTS PLTD/COATD WTHTIN OF THCKNS>=0.5MM,72,3432,Base Metals & Articles,Industrial Goods,2023-01-01 13:45:55
721012,"PRDCTS PLTD/COATD WTH TIN,OF THCKNS<0.5 MM",72,3433,Base Metals & Articles,Industrial Goods,2023-01-01 13:46:00
721020,PRDCTS PLTD/COTD WTH LEAD INCL TERNE/PLATE,72,3434,Base Metals & Articles,Industrial Goods,2023-01-01 13:46:05
721030,"FLT-ROLD PRDCTS OF IRON/NON ALOY STL      ELECTROLITICALLY PLTD/COTD WTH ZINC OF A  WDTH OF 600 MM OR MORE, CLAD, PLTD/C",72,3435,Base Metals & Articles,Industrial Goods,2023-01-01 13:46:10
721041,"CORUGATD PRDCTS,OTHRWS PLTD/COATD WTH ZINC",72,3436,Base Metals & Articles,Industrial Goods,2023-01-01 13:46:15
721049,OTHR PRDCTS OF IRON/NON-ALLOY STEEL       OTHERWISE PLTD/COTD WTH ZINC,72,3437,Base Metals & Articles,Industrial Goods,2023-01-01 13:46:20
721050,PRDCTS PLTD/COATD WTH CHROMIUM OXIDES     OR WITH CHROMIUM AND CHROMIUM OXIDE,72,3438,Base Metals & Articles,Industrial Goods,2023-01-01 13:46:25
721061,FLT-RLD PRDCTS OF IRON/NON ALOY STL PLTD  OR COTD WTH ALUMINIUM ZINC ALLOYS,72,3439,Base Metals & Articles,Industrial Goods,2023-01-01 13:46:30
721069,FLT-ROLD PRDCTS OF IRON/NON ALOY STL PLTD OR COTD WTH OTHER ALOYS OF ALUMINIUM EXCL (EXCL ZINC ALLOY),72,3440,Base Metals & Articles,Industrial Goods,2023-01-01 13:46:35
721070,"PRDCTS PAINTD,VRNSHD/COATD WTH PLSTCS",72,3441,Base Metals & Articles,Industrial Goods,2023-01-01 13:46:40
721090,"OTHR FLT-RLLD PRDCTS OF IRON/NON-ALOY STL CLAD,PLATED OR COATED,OF WIDTH>=600MM",72,3442,Base Metals & Articles,Industrial Goods,2023-01-01 13:46:45
721113,FLT-ROLD PRDCTS NT FRTHR WRKD THN HT-ROLD ROLD ON FOUR FACES OF WDTH >150MM AND THCNS >=4MM NT IN COILS AND WTHOUT PTRN,72,3443,Base Metals & Articles,Industrial Goods,2023-01-01 13:46:50
721114,"OTHER, OF A THICKNESS OF 4.75 MM OR MORE :",72,3444,Base Metals & Articles,Industrial Goods,2023-01-01 13:46:55
721119,"PRDCTS,HOT-ROLLED,OF THCKNS<4.75MM",72,3445,Base Metals & Articles,Industrial Goods,2023-01-01 13:47:00
721123,FLT-RLD PRDCTS OF IRON/NON-ALOY STL       NT FRTHR WRKD THN COLD-ROLD(COLD-REDUCD)  CONTNG BY WT  <0.25% OF CRBN,72,3446,Base Metals & Articles,Industrial Goods,2023-01-01 13:47:05
721129,"OTHR FLT-RLD PRDCTS OF IRON/NON-ALOY STL  NT FRTHR WRKD THN COLD-ROLD(COLD-RDUCD),  (EXCL 7211.23)",72,3447,Base Metals & Articles,Industrial Goods,2023-01-01 13:47:10
721190,"OTHER FLT-RLLD PRDCTS OF IRN/NON-ALOY STL OF WDTH<600MM,NT CLD,PLATD/COATD",72,3448,Base Metals & Articles,Industrial Goods,2023-01-01 13:47:15
721210,"PRODUCTS,PLATED OR COATED WITH TIN",72,3449,Base Metals & Articles,Industrial Goods,2023-01-01 13:47:20
721220,FLT-ROLD PRDCTS OF IRON/NON-ALOY STL OF A WDTH OF <600 MM ELECTROLITICALLY PLTD/COTDWTH ZINC,72,3450,Base Metals & Articles,Industrial Goods,2023-01-01 13:47:25
721230,OTHERWISE PLATED OR COATED WITH ZINC :,72,3451,Base Metals & Articles,Industrial Goods,2023-01-01 13:47:30
721240,"PRDCTS PAINTD,VARNSHD/COATD WTH PLASTIC",72,3452,Base Metals & Articles,Industrial Goods,2023-01-01 13:47:35
721250,OTHERWISE PLATED OR COATED :,72,3453,Base Metals & Articles,Industrial Goods,2023-01-01 13:47:40
721260,CLAD FLT-RLLD PRDCTS OF IRON/NON-ALLOY STL,72,3454,Base Metals & Articles,Industrial Goods,2023-01-01 13:47:45
721310,"BARS AND RODS HT-RLLD,CONTNG INDNTATIONS    RIBS,GROOVES/OTHR DEFORMATIONS PRODUCED   DURING THE ROLLING PROCESS",72,3455,Base Metals & Articles,Industrial Goods,2023-01-01 13:47:50
721320,"OTHER, OF FREE-CUTTING STEEL :",72,3456,Base Metals & Articles,Industrial Goods,2023-01-01 13:47:55
721391,"BARS AND RODS,HOT RLD OF IRON/NON ALOY STL  OF CRCULR CRS SCTN MSRNG <14 MM DIAMTR",72,3457,Base Metals & Articles,Industrial Goods,2023-01-01 13:48:00
721399,BARS AND RODS HOT-RLD OF IRON/NON ALOY STL  OTHR THN CRCULRCRS SCTN MSRNG >=14 MM IN  DIAMTR,72,3458,Base Metals & Articles,Industrial Goods,2023-01-01 13:48:05
721410,FORGED BARS AND RODS,72,3459,Base Metals & Articles,Industrial Goods,2023-01-01 13:48:10
721420,"BARS AND RODS CONTNG INDENTATIONS,RIBS,     GROOVES/OTHR DEFORMATION PRDCD DURNG      ROLLING PRCSS/TWSTD AFTER ROLLING",72,3460,Base Metals & Articles,Industrial Goods,2023-01-01 13:48:15
721430,"OTHER, OF FREE CUTTING STEEL",72,3461,Base Metals & Articles,Industrial Goods,2023-01-01 13:48:20
721491,BARS AND RODS OF RECTANGULAR (OTHER THAN    SQUARE) CROSS-SECTION OF IRON/NON ALOY STL,72,3462,Base Metals & Articles,Industrial Goods,2023-01-01 13:48:25
721499,BARS AND RODS OF IRON/NON ALOY STL OTHR THN RECTANGULAR (EXCL SQR)CRS SCTN,72,3463,Base Metals & Articles,Industrial Goods,2023-01-01 13:48:30
721510,"BARS AND RODS OF FREE-CUTTING STL,          COLD-FORMED/COLD-FINISHED",72,3464,Base Metals & Articles,Industrial Goods,2023-01-01 13:48:35
721550,"OTHER, NOT FURTHER WORKED THAN COLD-FORMED OR COLD-FINISHED :",72,3465,Base Metals & Articles,Industrial Goods,2023-01-01 13:48:40
721590,OTHR BARS AND RODS OF IRON/NON-ALLOY STL,72,3466,Base Metals & Articles,Industrial Goods,2023-01-01 13:48:45
721610,"U,I OR H SECTIONS,HOT-ROLLED,HOT-DRAWN    EXTRUDED,OF A HEIGHT OF LESS THAN 80 MM",72,3467,Base Metals & Articles,Industrial Goods,2023-01-01 13:48:50
721621,"L-SCTNS,HT-RLLD HT-DRWN OF HEIGHT<80MM",72,3468,Base Metals & Articles,Industrial Goods,2023-01-01 13:48:55
721622,"T-SCTNS,HT-RLLD,HT-DRWN OF HEIGHT<80 MM",72,3469,Base Metals & Articles,Industrial Goods,2023-01-01 13:49:00
721631,"U-SCTNS,HT-RLLD,HT-DRWN OF HEIGHT>=80 MM",72,3470,Base Metals & Articles,Industrial Goods,2023-01-01 13:49:05
721632,"I-SCTNS,HT-RLLD,HT-DRWN OF HEIGHT>=80 MM",72,3471,Base Metals & Articles,Industrial Goods,2023-01-01 13:49:10
721633,"H-SCTNS,HT-RLLD,HT-DRWN OF HEIGHT>=80 MM",72,3472,Base Metals & Articles,Industrial Goods,2023-01-01 13:49:15
721640,"L/T SCTNS,HT-RLLD,HT-DRWN OF HEIGHT>=80 MM",72,3473,Base Metals & Articles,Industrial Goods,2023-01-01 13:49:20
721650,"OTHER ANGLES, SHAPES AND SECTIONS, NOT    FURTHER WORKED THAN HOT-ROLLED, HOT-DRAWN OR EXTRUDED",72,3474,Base Metals & Articles,Industrial Goods,2023-01-01 13:49:25
721661,ANGLE SHAPES ETC NT FRTHR WRKD THN COLD   FRMD/COLD FINSHD OBTND FRM FLT-RLD PRDCTS,72,3475,Base Metals & Articles,Industrial Goods,2023-01-01 13:49:30
721669,ANGLE SHAPES ETC NT FRTHR WRKD THN COLD   FRMD/COLD FINSHD OBTND FRM OTHR PRDCTS    OTHR THN FLT-ROLD,72,3476,Base Metals & Articles,Industrial Goods,2023-01-01 13:49:35
721691,ANGLE SHAPES ETC COLD-FRMD/COLD FINSHD FRMFLT ROLD PRDCTS,72,3477,Base Metals & Articles,Industrial Goods,2023-01-01 13:49:40
721699,OTHER :,72,3478,Base Metals & Articles,Industrial Goods,2023-01-01 13:49:45
721710,"WIRE OF IRON/NON-ALOY STL, NT PLTD/COTD,  WHETHER OR NOT POLISHD",72,3479,Base Metals & Articles,Industrial Goods,2023-01-01 13:49:50
721720,"WIRE OF IRN/NON-ALOY STL,PLTD/COTD WTH ZNC",72,3480,Base Metals & Articles,Industrial Goods,2023-01-01 13:49:55
721730,WIRE OF IRON/NON-ALOY STL PLTD/COTD WTH   OTHR BASE METL (EXCL ZINC),72,3481,Base Metals & Articles,Industrial Goods,2023-01-01 13:50:00
721790,OTHER WIRE OF IRONNON-ALOY STEEL         CONTAINING BY WEIGHT<0.25% OFCARBON,72,3482,Base Metals & Articles,Industrial Goods,2023-01-01 13:50:05
721810,INGOTS AND OTHR PRIMARY FORMS               OF STAINLESS STEEL,72,3483,Base Metals & Articles,Industrial Goods,2023-01-01 13:50:10
721891,SEMI FINISHED PRDCTS OF STNLS STL OF      RECTANGULAR (OTHR THN SQR) CROS-SCTN,72,3484,Base Metals & Articles,Industrial Goods,2023-01-01 13:50:15
721899,OTHER SEMI-FINISHED PRODUCTS OF STAINLS ST,72,3485,Base Metals & Articles,Industrial Goods,2023-01-01 13:50:20
721911,HT-RLLD PRDCTS IN COILS OF THCKNS>10 MM,72,3486,Base Metals & Articles,Industrial Goods,2023-01-01 13:50:25
721912,HT-RLLD PRDCTS IN COILS OF THCKNS         >=4.75 MM BT<10 MM,72,3487,Base Metals & Articles,Industrial Goods,2023-01-01 13:50:30
721913,HT-RLLD PRDCTS IN COILS OFTHCKNS >=       3 MM BT < 4.75 MM,72,3488,Base Metals & Articles,Industrial Goods,2023-01-01 13:50:35
721914,HT-RLLD PRDCTS IN COILS OF THCKNS<3 MM,72,3489,Base Metals & Articles,Industrial Goods,2023-01-01 13:50:40
721921,HT-RLLD PRDCTS NT IN COILS OF THCKNS>10MM,72,3490,Base Metals & Articles,Industrial Goods,2023-01-01 13:50:45
721922,"HOT-RLLD,PRDCTS NT IN COILS OF THCKNS>=   4.75 MM BUT <10 MM",72,3491,Base Metals & Articles,Industrial Goods,2023-01-01 13:50:50
721923,HT-RLLD PRDCTS NT IN COILS OF THCKNS OF   >=3MM BUT <4.75 MM,72,3492,Base Metals & Articles,Industrial Goods,2023-01-01 13:50:55
721924,"HT-RLLD PRDCTS NT IN COILS,OF THCKNS <3 MM",72,3493,Base Metals & Articles,Industrial Goods,2023-01-01 13:51:00
721931,COLD-RLLD PRDCTS OF THCKNS>=4.75 MM,72,3494,Base Metals & Articles,Industrial Goods,2023-01-01 13:51:05
721932,COLD-RLLD PRDCTS OF THCKNS>=3 MM BT<4.75MM,72,3495,Base Metals & Articles,Industrial Goods,2023-01-01 13:51:10
721933,COLD-RLLD PRDCTS OF THCKNS>1 MM BT<3 MM,72,3496,Base Metals & Articles,Industrial Goods,2023-01-01 13:51:15
721934,COLD-RLLD PRDCTS OF STAINLESS STEEL OF A  THICKNESS >= 0.5 MM BUT < 1 MM,72,3497,Base Metals & Articles,Industrial Goods,2023-01-01 13:51:20
721935,COLD-RLLD PRDCTS OF THCKNS<0.5 MM,72,3498,Base Metals & Articles,Industrial Goods,2023-01-01 13:51:25
721990,OTHR FLAT-RLLD PRDCTS OF STAINLESS-STEEL  OF WDTH >=600 MM,72,3499,Base Metals & Articles,Industrial Goods,2023-01-01 13:51:30
722011,HT-RLLD PRDCTS OF THCKNS>=4.75 MM,72,3500,Base Metals & Articles,Industrial Goods,2023-01-01 13:51:35
722012,HT-RLLD PRDCTS OF THCKNS <4.75 MM,72,3501,Base Metals & Articles,Industrial Goods,2023-01-01 13:51:40
722020,COLD ROLLED PRODUCTS OF STAINLESS STEEL OFWIDTH LESS THAN 600 MM,72,3502,Base Metals & Articles,Industrial Goods,2023-01-01 13:51:45
722090,OTHR FLT-RLLD PRDCTS OF STAINLESS STEEL   OF WIDTH LESS THN 600 MM,72,3503,Base Metals & Articles,Industrial Goods,2023-01-01 13:51:50
722100,"BARS AND RODS,HT-ROLLD,IN IRRGLRLY WOUND    COILS,OF STNLS STL",72,3504,Base Metals & Articles,Industrial Goods,2023-01-01 13:51:55
722211,"BARS AND RODS, NT FRTHR WRKD THN HT-ROLD    HT DRWN/EXTRUDED OF CIRCULR CRS SCTN",72,3505,Base Metals & Articles,Industrial Goods,2023-01-01 13:52:00
722219,BARS AND RODS NT FRTHR WRKD THN HT-ROLD     HT-DRWN/EXTRUDED OTHR THN CIRCLR CRS-SCTN,72,3506,Base Metals & Articles,Industrial Goods,2023-01-01 13:52:05
722220,"BARS AND RODS,COLD-FORMED OR COLD-FINISHED",72,3507,Base Metals & Articles,Industrial Goods,2023-01-01 13:52:10
722230,OTHER BARS AND RODS :,72,3508,Base Metals & Articles,Industrial Goods,2023-01-01 13:52:15
722240,"ANGLES,SHAPES AND SECTIONS",72,3509,Base Metals & Articles,Industrial Goods,2023-01-01 13:52:20
722300,WIRE OF STAINLESS STEEL,72,3510,Base Metals & Articles,Industrial Goods,2023-01-01 13:52:25
722410,INGOTS AND OTHER PRIMARY FORMS,72,3511,Base Metals & Articles,Industrial Goods,2023-01-01 13:52:30
722490,OTHR SEMI-FNSHD PRDCTS OF OTHR ALLOY STEEL,72,3512,Base Metals & Articles,Industrial Goods,2023-01-01 13:52:35
722511,FLT-RLD PRDCTS OF SILICON ELCTRCL STL     GRAIN ORIENTED,72,3513,Base Metals & Articles,Industrial Goods,2023-01-01 13:52:40
722519,FLT-ROLD PRDCTS OF SILICON ELCTRCL STL    OTHR THN GRAIN ORIENTED,72,3514,Base Metals & Articles,Industrial Goods,2023-01-01 13:52:45
722530,OTHER HOT-ROLLED PRODUCTS; IN COILS,72,3515,Base Metals & Articles,Industrial Goods,2023-01-01 13:52:50
722540,"OTHER, NOT FURTHER WORKED THAN HOT-ROLLED, NOT IN COILS :",72,3516,Base Metals & Articles,Industrial Goods,2023-01-01 13:52:55
722550,"OTHER, NOT FURTHER WORKED THAN COLD-ROLLED (COLD-REDUCED) :",72,3517,Base Metals & Articles,Industrial Goods,2023-01-01 13:53:00
722591,FLT-ROLD PRDCTS OF OTHER ALLOY STEEL      ELECTROLITICALLY PLTD/COTD WTH ZINC,72,3518,Base Metals & Articles,Industrial Goods,2023-01-01 13:53:05
722592,OTHERWISE PLATED OR COATED WITH ZINC,72,3519,Base Metals & Articles,Industrial Goods,2023-01-01 13:53:10
722599,OTHER FLT-RLD PRDCTS OF OTHER ALLOY-STEEL,72,3520,Base Metals & Articles,Industrial Goods,2023-01-01 13:53:15
722611,FLT-RLD PRDCTS OF SILICON ELECTRICAL STL  GRAIN-ORIENTED,72,3521,Base Metals & Articles,Industrial Goods,2023-01-01 13:53:20
722619,FLT-ROLD PRDCTS OF SILICON ELECTRICAL STL OTHR THN GRAIN-ORIENTED,72,3522,Base Metals & Articles,Industrial Goods,2023-01-01 13:53:25
722620,PRDCTS OF HIGH SPEED STL,72,3523,Base Metals & Articles,Industrial Goods,2023-01-01 13:53:30
722691,OTHER HOT ROLLED PRODUCTS OF OTHER ALLOY  STEEL OF WIDTH LESS THAN 600 MM,72,3524,Base Metals & Articles,Industrial Goods,2023-01-01 13:53:35
722692,OTHER COLD ROLLED PRODUCTS OF OTHER ALLOY STEEL OF WIDTH LESS THAN 600 MM,72,3525,Base Metals & Articles,Industrial Goods,2023-01-01 13:53:40
722699,OTHER FLAT ROLLED PRODUCTS OF OTHER ALLOY STEEL OF WIDTH LESS THAN 600 MM,72,3526,Base Metals & Articles,Industrial Goods,2023-01-01 13:53:45
722710,"BARANDRODS OF OTHR ALLOY HIGH SPEED STEEL   IN IRREGULARLY WOUND COILS,HOT-ROLLED",72,3527,Base Metals & Articles,Industrial Goods,2023-01-01 13:53:50
722720,"BARS AND RODS OF SILICO-MANGANESE STEEL,HOT-ROLLED,IN IRREGULARLY WOUND COILS",72,3528,Base Metals & Articles,Industrial Goods,2023-01-01 13:53:55
722790,OTHR HT-RLLD BARS AND RODS OF OTHR ALLOY STLIN IRREGULARLY WOUND COILS,72,3529,Base Metals & Articles,Industrial Goods,2023-01-01 13:54:00
722810,BARS AND RODS OF HIGH SPEED STEEL,72,3530,Base Metals & Articles,Industrial Goods,2023-01-01 13:54:05
722820,OTHER BARS ANDRODS OF SILICO MANGANESE STEEL,72,3531,Base Metals & Articles,Industrial Goods,2023-01-01 13:54:10
722830,"OTHER BARS AND RODS, NOT FURTHER WORKED   THAN HOT-ROLLED, HOT-DRAWN OR EXTRUDED :",72,3532,Base Metals & Articles,Industrial Goods,2023-01-01 13:54:15
722840,"OTHER BARS AND RODS, NOT FURTHER WORKED   THAN FORGED",72,3533,Base Metals & Articles,Industrial Goods,2023-01-01 13:54:20
722850,"OTHER BARS AND RODS, NOT FURTHER WORKED   THAN COLD-FORMED OR COLD-FINISHED :",72,3534,Base Metals & Articles,Industrial Goods,2023-01-01 13:54:25
722860,OTHER BARS AND RODS :,72,3535,Base Metals & Articles,Industrial Goods,2023-01-01 13:54:30
722870,"ANGLES,SHAPES AND SECTIONS",72,3536,Base Metals & Articles,Industrial Goods,2023-01-01 13:54:35
722880,HOLLOW DRILL BARS AND RODS,72,3537,Base Metals & Articles,Industrial Goods,2023-01-01 13:54:40
722920,WIRE OF OTHR ALLOY SILICO MANGANESE STEEL,72,3538,Base Metals & Articles,Industrial Goods,2023-01-01 13:54:45
722990,OTHER WIRE,72,3539,Base Metals & Articles,Industrial Goods,2023-01-01 13:54:50
730110,SHEET PILING,73,3540,Base Metals & Articles,Industrial Goods,2023-01-01 13:54:55
730120,"ANGLES,SHAPES AND SECTIONS",73,3541,Base Metals & Articles,Industrial Goods,2023-01-01 13:55:00
730210,RAILS,73,3542,Base Metals & Articles,Industrial Goods,2023-01-01 13:55:05
730230,"SWITCH BLADES,CROSSING FROGS,POINT RODS   AND OTHER CROSSING PIECES",73,3543,Base Metals & Articles,Industrial Goods,2023-01-01 13:55:10
730240,FISHPLATES AND SOLEPLATES,73,3544,Base Metals & Articles,Industrial Goods,2023-01-01 13:55:15
730290,OTHR RLY/TRAMWAY TRACK CNSTRCTN MATRLS,73,3545,Base Metals & Articles,Industrial Goods,2023-01-01 13:55:20
730300,"TUBES,PIPES AND HOLLOW PROFILES OF CAST IRON",73,3546,Base Metals & Articles,Industrial Goods,2023-01-01 13:55:25
730411,OF STAINLESS STEEL:,73,3547,Base Metals & Articles,Industrial Goods,2023-01-01 13:55:30
730419,OTHER:,73,3548,Base Metals & Articles,Industrial Goods,2023-01-01 13:55:35
730422,DRILL PIPE OF STAINLESS STEEL,73,3549,Base Metals & Articles,Industrial Goods,2023-01-01 13:55:40
730423,OTHER DRILL PIPE:,73,3550,Base Metals & Articles,Industrial Goods,2023-01-01 13:55:45
730424,"OTHER, OF STAINLESS STEEL",73,3551,Base Metals & Articles,Industrial Goods,2023-01-01 13:55:50
730429,"CASING, TUBING OF IRON/STEEL",73,3552,Base Metals & Articles,Industrial Goods,2023-01-01 13:55:55
730431,"OTHR TUBE/PIPE OR HOLO PROFILE OF CIRCULR CROSS-SECTION OF IRON/NON-ALLOY STEEL,    COLD-DRAWN OR COLD ROLLED",73,3553,Base Metals & Articles,Industrial Goods,2023-01-01 13:56:00
730439,OTHER TUBE/PIPE OR HOLO PROFILE OF CIRCULRCROSS-SECTON OTHR THN COLD-DRAWN/COLD RLLD,73,3554,Base Metals & Articles,Industrial Goods,2023-01-01 13:56:05
730441,"OTHR TUBS,PIPE AND HOLO PROFILE OF CIRCULR  CROSS-SECTION OF STAINLES STEEL,COLD DRAWNOR COLD ROLLED",73,3555,Base Metals & Articles,Industrial Goods,2023-01-01 13:56:10
730449,"OTHR TUBE,PIPE AND HOLO PROFILE OF CIRCULR  CROSS-SECTION OF OTHER STAINLESS STEEL",73,3556,Base Metals & Articles,Industrial Goods,2023-01-01 13:56:15
730451,"OTHER TUBE,PIPE HOLO PROFILE OF CIRCULR   CROSS-SECTION OF OTHER ALLOY STEEL,       COLD-DRAWN OR COLD-ROLLED (COLD-REDU",73,3557,Base Metals & Articles,Industrial Goods,2023-01-01 13:56:20
730459,"OTHER TUBS,PIPS HOLO PROFILES OF CIRCULAR CROSS-SECT OF OTHR ALLOY-STEEL,NOT CLD RLD",73,3558,Base Metals & Articles,Industrial Goods,2023-01-01 13:56:25
730490,OTHR SEAMLESS TUBES/PIPES AND HOLOW PORFILES,73,3559,Base Metals & Articles,Industrial Goods,2023-01-01 13:56:30
730511,LINE PIPE USED FOR OIL OR GAS PIPELINES   LONGITUDINALLY SUBMERGED ARC WELDED       HAVING EXTERNAL DIAMETER >406.4MM,73,3560,Base Metals & Articles,Industrial Goods,2023-01-01 13:56:35
730512,"OTHER, LONGITUDINALLY WELDED :",73,3561,Base Metals & Articles,Industrial Goods,2023-01-01 13:56:40
730519,OTHR LINE PIPE USED FOR OIL/GAS PIPELINES HAVING EXTERNAL DIAMETER >406.4MM,73,3562,Base Metals & Articles,Industrial Goods,2023-01-01 13:56:45
730520,CASING USED IN DRILLING FOR OIL OR GAS    HAVING EXTERNAL DIAMETER >406.4MM,73,3563,Base Metals & Articles,Industrial Goods,2023-01-01 13:56:50
730531,"OTHR TUBES,PIPS ETC,LONGITUDINALLY WELDED HAVING EXTERNAL DIAMETER >406.4MM",73,3564,Base Metals & Articles,Industrial Goods,2023-01-01 13:56:55
730539,"OTHER TUBES PIPES ETC,OTHERWISE WELDED    WITH EXTERNAL DIAMETER >406.4 MM",73,3565,Base Metals & Articles,Industrial Goods,2023-01-01 13:57:00
730590,OTHR TUBESANDPIPES HVNG INTRNLANDEXTRNL CIRCLRCROSS-SECTIONS WTH EXTRNL DIAMTR>406.4MM,73,3566,Base Metals & Articles,Industrial Goods,2023-01-01 13:57:05
730611,"WELDED, OF STAINLESS STEEL",73,3567,Base Metals & Articles,Industrial Goods,2023-01-01 13:57:10
730619,OTHER:,73,3568,Base Metals & Articles,Industrial Goods,2023-01-01 13:57:15
730621,"WELDED, OF STAINLESS STEEL",73,3569,Base Metals & Articles,Industrial Goods,2023-01-01 13:57:20
730629,OTHER,73,3570,Base Metals & Articles,Industrial Goods,2023-01-01 13:57:25
730630,"OTHER, WELDED, OF CIRCULAR CROSS-SECTION, OF IRON OR NON-ALLOY STEEL:",73,3571,Base Metals & Articles,Industrial Goods,2023-01-01 13:57:30
730640,"OTHER, WELDED, OF CIRCULAR CROSS-SECTION, OF",73,3572,Base Metals & Articles,Industrial Goods,2023-01-01 13:57:35
730650,"OTHER, WELDED, OF CIRCULAR CROSS-SECTION, OF OTHER ALLOY STEEL",73,3573,Base Metals & Articles,Industrial Goods,2023-01-01 13:57:40
